title,link,image_url,content
Kinh nghiệm du lịch rừng thông Yên Minh: Đà Lạt thu nhỏ của Hà Giang,https://dulichvietnam.com.vn/kinh-nghiem-du-lich-rung-thong-yen-minh.html,https://dulichvietnam.com.vn/vnt_upload/news/07_2025/thumbs/560_crop_Kinh_nghiem_du_lich_rung_thong_Yen_Minh_11.jpg,"Kinh nghiệm du lịch rừng thông Yên Minhvới cụ thể đường đi, trải nghiệm thú vị sẽ giúp bạn và gia đình có những phút giây tràn ngập niềm vui. Hãy cùng theo chân Du lịch Việt Nam khám phá rừng thông này nào. Rừng thông Yên Minh ở đâu hay vị trí chính xác của rừng thông Yên Minh là điều mà nhiều người thắc mắc khi lên kế hoạch cho chuyến đi của mình. Cụ thể, rừng thông trải dài từ xã Na Khê đến thị trấn Yên Minh, huyện Yên Minh, tỉnh Hà Giang cũ (sau sáp nhập là xã Bạch Đích, xã Yên Minh, tỉnh Tuyên Quang). Bên cạnh đèo Mã Pí Lèng huyền thoại, sông Nho Quế xanh biếc, rừng thông Yên Minh là điểm nhất định phải đến khi du lịch Hà Giang. Như vậy, sau khi biết rừng thông Yên Minh ở đâu, còn chần chờ gì nữa mà không lập team tới đây khám phá thôi nào. Cùng vớikinh nghiệm du lịch rừng thông Yên Minhdưới đây, chắc chắn bạn sẽ có chuyến đi thú vị đấy. Cách trung tâm TP Hà Nội hơn 370km,đường đi rừng thông Yên Minh Hà Giangkhá xa xôi, mất tầm 7-8 tiếng đi lại. Bạn đi theo cao tốc Hà Nội – Lào Cai – Tuyên Quang – Phú Thọ - Quốc lộ 37 – Quốc lộ 2 – Quốc lộ 4C là tới. Đường cao tốc dễ đi, đẹp, chỉ cần chú ý quan sát biển báo tốc độ là được. Đoạn đường đèo Quốc lộ 4C có những khúc cua tay áo nguy hiểm, đòi hỏi người lái xe phải quan sát kỹ càng để đảm bảo an toàn. Nếu tự lái xe, du khách nên chia chặng đường để đảm bảo nghỉ ngơi, hoặc có người đi cùng để đổi lái. Còn không, nhiều người chọn đi xe khách giường nằm từ đêm hôm trước và tới Hà Giang vào sáng sớm hôm sau. Rừng thông Yên Minh cách TP Hà Giang tầm 82km, tốn hơn 2 tiếng đi lại. Từ thành phố, khi du khách đi lên hướng Đồng Văn, Mèo Vạc sẽ đi qua Yên Minh. Theokinh nghiệm du lịch rừng thông Yên Minh, bạn men theo quốc lộ 4C chạy qua 2 xã Na Khê và Lao Và Chải, rừng thông sẽ dần hiện ra trước mắt. Trên đường đi có biển báo chỉ dẫn nên bạn cũng có thể yên tâm. Theo kinh nghiệm du lịch rừng thông Yên Minh Hà Giang Tuyên Quang, đây là rừng thông nhân tạo, được ví như Đà Lạt thu nhỏ của miền núi Đông Bắc. Với diện tích 98 ha, ở đây có hàng trăm cây thông xanh rì đâm cao vút lên bầu trời đón nắng. Hà Giang vẫn gây thương nhớ bởi vẻ đẹp mộc mạc và bình dị. Rời bước khỏi cung đường quốc lộ tấp nập, đi qua những con xã nhỏ, rừng thông hiện ra như một thế giới khác trước mắt du khách. Đặt chân tới rừng thông, bạn sẽ nghe thấy hương thơm thoang thoảng của cây cối, nứi rừng, thứ hương thơm mà khó thể tìm thấy ở chốn thành thị xô bồ. Càng tiến lại gần, kháchdu lịch Hà Giangsẽ càng thấy ngỡ ngàng bởi cây thông ở đây dù chẳng cần chăm sóc gì cầu kỳ cũng phát triển mạnh mẽ tựa như ý chí, sức sống bền bỉ của con người mảnh đất cao nguyên đá này. Kinh nghiệm đi rừng thông Yên Minhnữa đó làthời điểm để ngắm cảnh rừng thông đẹp nhất là bình minh hoặc chiều tà. Vào sáng sớm khi làn sương sớm vẫn còn đọng lại trên tán cây, còn mờ ảo vương vấp khắp cánh rừng, không khí ở đây lại se lạnh khiến ta ngỡ như đang ở Đà Lạt vậy. Còn chiều tà, ánh hoàng hôn chiếu rọi xuống tán lá, lấp lánh ánh vàng trông càng lãng mạn và nên thơ. Nhiều du khách tới rừng thông Yên Minh để đi dạo, để hít thở không khí trong lành và để hoà mình vào thiên nhiên. Theo kinh nghiệm du lịch rừng thông Yên Minh Hà Giang Tuyên Quang, ở đây chẳng có tiếng còi xe inh ỏi, chẳng có nhà cao tầng hay khói bụi, rất thích hợp để thư giãn, chữa lành cho những trái tim mệt mỏi. Tới rừng thông Yên Minh, du khách đừng quên tham gia trekking leo lên đỉnh đồi. Bạn có thể để xe ở dưới chân đồi và leo núi. Việc leo lên rừng thông không có gì khó khăn, thích hợp với cả những ai không có nhiều kinh nghiệm trekking trước đó. Đi dọc rừng thông, bạn sẽ càng cảm thấy bình yên và thêm yêu mến vẻ đẹp thiên nhiên nơi này. Theokinh nghiệm du lịch rừng thông Yên Minh, khu rừng này còn là địa chỉ lý tưởng cho hoạt động dã ngoại, cắm trại ngoài trời nữa đấy.Cắm trại rừng thông Yên Minhkhông phải quá mới mẻ nhưng nơi đây vẫn vô cùng hoang sơ, thu hút nhiều người tới trải nghiệm. Ở rừng thông có những khu đất bằng phẳng, thích hợp để dựng lều hạ trại. Còn gì thú vị hơn khi được cùng bạn bè, người thân tới rừng thông Yên Minh cắm trại, hàn huyên tâm sự và lưu giữ kỷ niệm đúng không nào? Bạn có thể cắm trại qua đêm và đón bình mình thật sớm đấy. Không khí sáng sớm se lạnh, dễ chịu, du khách đừng quên nhâm nhi tách trà nóng và đưa mắt ra xa ngắm nhìn khung cảnh xung quanh nhé. Một ngày ở huyện vùng cao Hà Giang bắt đầu bình dị, nhẹ nhàng như vậy đấy. Theo kinh nghiệm du lịch rừng thông Yên Minh Hà Giang Tuyên Quang, nếu dã ngoại hay tổ chức ăn uống, tốt nhất bạn nên mang theo đồ ăn, nước uống sẵn. Nếu món nào cần nấu nướng thì nên mang theo bếp ga du lịch nhưng cần đảm bảo không gây cháy, nổ, giữ gìn cảnh quan môi trường. Sau khicắm trại rừng thông Yên Minh, bạn cần dọn dẹp sạch rác để bảo vệ thiên nhiên. Bạn có thể tới rừng thông Yên Minh bất kể thời điểm nào trong năm vì mỗi thời điểm lại có một nét đẹp riêng cần khám phá. Mùa thu ở đây mát mẻ, thích hợp cho các hoạt động ngoài trời. Tuy nhiên, bạn nên tránh đi vào những ngày mưa bão vì đất sẽ trơn trượt, không an toàn cũng không cắm trại được. Lùng Tám là một xã của huyện Quản Bạ, cách trung tâm TP. Hà Giang 50 km. Theokinh nghiệm du lịch rừng thông Yên Minh, sau khi ghé thăm rừng thông, bạn có thể di chuyển theo Quốc lộ 4C để tới Lùng Tám. Xã này nổi tiếng với nghề dệt lanh truyền thống của người Mông. Tại đây, bà con vẫn dệt lanh với nguyên liệu tự nhiên theo quy trình thủ công. Làng Lùng Tám cực được khách Tây yêu thích. Khi tới đây, ngoài việc tìm hiểu văn hoá và lịch sử nghề dệt lanh, khách du lịch còn được trực tiếp trải nghiệm việc tạo nên một tấm vải. Qua đó, bạn sẽ thấy được sự khéo léo, chăm chỉ của phụ nữ Mông. Du khách cũng có thể mua sản phẩm lanh về làm quà cho người thân ở nhà sau chuyến vi vu. Với những ai đam mê cảm giác mạnh thì Dốc Thẩm Mã ở Hà Giang chính là địa chỉ không thể bỏ qua. Nằm trên Quốc lộ 4C, Dốc Thẩm Mã là con đường đèo nối TP Hà Giang với huyện Mèo Vạc. Con đèo này nổi tiếng với 9 khúc cua uốn lượn ngoằn ngoèo. Nhìn từ trên cao, Dốc Thẩm Mã tựa như một con rắn khổng lồ, nguy hiểm nhưng lại đầy mê hoặc. Sở dĩ có tên Dốc Thẩm Mã bởi xưa kia, dốc này dùng để thẩm định sức dẻo dai của những chú ngựa bằng cách thồ hàng từ chân dốc lên tới đỉnh dốc. Trên đây làkinh nghiệm du lịch rừng thông Yên Minhcho bạn và gia đình tham khảo. Theo dõiDu lịch Việt Namđể cập nhật thêm nhiều điểm đến mới cùng kinh nghiệm vi vu hữu ích trong chuyến đi sắp tới của mình nhé. Yến Yến"
Lên Quản Bạ đừng quên ghé làng Nặm Đăm Hà Giang Tuyên Quang,https://dulichvietnam.com.vn/lang-nam-dam-ha-giang-tuyen-quang.html,https://dulichvietnam.com.vn/vnt_upload/news/06_2025/thumbs/360_crop_Lang_Nam_Dam_Ha_Giang_12.jpg,"Hà Giang có nhiều ngôi làng nhỏ nổi tiếng như Lô Lô Chải, làng Lũng Cẩm…. Trong đó, không thể bỏ quaLàng Nặm Đăm Hà Giang. Cùng theo chân Du lịch Việt Nam khám phá xem ngôi làng này có gì hấp dẫn nhé. Làng Nặm Đăm ở đâu hay vị trí chính xác của làng Nặm Đăm là điều mà nhiều người đang thắc mắc khi lên lịch cho chuyến đi của mình. Cụ thể, ngôi làng này nằm ở xã Quản Bạ, huyện Quản Bạ, tỉnh Hà Giang cũ (sau khi sáp nhập là xã Quản Bạ, tỉnh Tuyên Quang). Nặm Đăm đang dần được biết đến bởi du khách trong và ngoài nước. Nơi đây không chỉ có thiên nhiên hùng vỹ, nguyên sơ mà còn quyến rũ khách du lịch khắp nơi bởi nét văn hóa đặc sắc của người dân bản địa. Như vậy, sau khi biết làng Nặm Đặm ở đâu, còn chần chờ gì nữa mà không lập team với hội bạn thân tới đây khám phá thôi nào. Chắc chắnLàng Nặm Đăm Hà Giang Tuyên Quangsẽ không khiến bạn thất vọng đâu. Cách trung tâm TP Hà Nội gần 350km, việc di chuyển tới Nặm Đặm mất khoảng 7 tiếng đồng hồ. Bạn đi theo cao tốc Hà Nội – Lào Cai – Tuyên Quang – Phú Thọ - Quốc lộ 2 – Quốc lộ 4C là tới. Đường đi cao tốc không có gì khó khăn nhưng đến đoạn đường đèo ở Hà Giang không dành cho những tay lái yếu. Một bên là vực sâu thăm thẳm với những khúc cua tay áo, một bên là núi cao sừng sừng nếu không vững tay lái sẽ rất nguy hiểm. Ngoài ra, khách du lịch thường chọn đi xe giường nằm vào tối hôm trước và tới Quản Bạ - Hà Giang vào sáng sớm hôm sau. Bạn tham khảo một số xe như xe Vũ Hán, xe Quang Nghị, Bằng Phấn… Du khách có thể tới TP Hà Giang, nơi cách làng Nặm Đăm khoảng 50km, sau đó thuê xe ôm, xe ô tô bản địa hoặc tự lái xe máy để lên ngôi làng này. Từ thị trấn Quản Bạ tớilàng Nặm Đăm Hà Giangchỉ 10km, bạn cũng có thể vi vu thị trấn sau đó ghé thăm làng. Trên tuyến đường Hạnh Phúc tới với Nặm Đăm, khách du lịch sẽ tha hồ tận hưởng cảm giác mạnh cũng như khung cảnh miền sơn cước Đông Bắc hùng vỹ. >>Xem thêm:Làng Sảo Há Hà Giang: Ngôi làng địa ngục bị bỏ quên Làng Văn hóa du lịch cộng đồng Nặm Đăm Hà Gianglà điểm đến cách không xa núi đôi Quản Bạ cũng như trung tâm huyện là bao. Ấy vậy mà, nơi này vẫn còn nguyên những nét hoang sơ, nằm nép mình trong thung lũng xinh đẹp, không khí trong lành, thoáng đãng. Xung quanh làng là núi non cao vời vợi, rừng rậm xanh ngát, cảm tượng như đưa ta vào một thế giới khác biệt hoàn toàn với chốn đô thị phồn hoa, oi ả. Tới vớiLàng Văn hóa du lịch cộng đồng Nặm Đăm Hà Giang,mùa nào bạn cũng sẽ cảm nhận được một nét đẹp rất riêng. Những thửa ruộng bậc thang ở đây thay đổi theo mùa, khi thì xanh ngắt, khi thì vàng óng, lúc lại lênh láng nước đổ như gương soi… Ở đầulàng Nặm Đăm Tuyên Quanglà một hồ nước lớn, tạo nên điểm nhấn thơ mộng cho miền sơn cước. Tại đây, ngoài ngắm cảnh, những đám mây trắng in hằn xuống mặt nước, các tín đồ đam mê vận động còn có thể chèo thuyền, câu cá cũng rất thú vị. Du khách đi sâu vào thôn còn được khám phá vùng trồng dược liệu, xem hợp tác xã chế biển sản xuất dược phẩm theo phương pháp thủ công truyền thống. Bạn có thể mua về làm quà cho người thân sau chuyến đi nữa đấy. Con đường dẫn vào sâu trongLàng Văn hóa du lịch cộng đồng Nặm Đăm Hà Gianguốn lượn nhẹ nhàng, tiếng gió cây đung đưa trong gió, hương hoa rừng thoang thoảng trong không khí, xa xa là tiếng cười nói của bà con và tiếng trẻ em nô đùa, tiếng trâu bò bước đi thong dong trên nền đất…. Tất cả tạo nên một bức tranh đồng quê tuyệt đẹp và bình dị. Buổi chiều tà có lẽ là lúc Nặm Đăm chìm vào trong mộng mơ nhất. Đó là khi những nếp nhà xinh xắn cùng khói bếp toả ra khắp nơi thật nên thơ. Các homestay trong thôn được làm rất chỉn chu mà vẫn giữ nguyên nét truyền thống địa phương. Nếu có thời gian hãy ở lại qua đêm trong homestay, trò chuyện với người dân bản địa để hiểu hơn về cuộc sống và những gì bình yên nhất tạilàng Nặm Đăm Hà Giang. Nếu may mắn, kháchdu lịch Hà Giangsẽ còn được thấy những áng mây bồng bềnh bay khắp rừng tựa như một dòng sông mây trắng ở trên không trung vậy. Cảm giác tay có thể chạm vào mây trước mắt, khiến trái tim ta phải tan chảy, rồi cũng quên hết mọi âu lo. Thác Nai cũng là một điểm đến thu hút các bạn trẻ đam mê khám phá thiên nhiên. Theo lời kể của người dân địa phương, trước đây, thanh niên trai tráng trong làng thường tập hợp đi săn thú rừng như nai, sơn dương, lợn rừng… Một ngày nọ, thanh niên phát hiện con nai tới gần thác nước nên chạy đuổi theo và bắt được. Từ đó, thác nước này được gọi là thác Nai. Tới nay, thác Nai vẫn chưa được nhiều người biết, còn nguyên vẻ hoang sơ vốn có. Vào mùa mưa, nước thác từ trên cao đổ xuống trắng xoá, xung quanh là cây cối rậm rạp tạo nên bức tranh thiên nhiên quá đỗi hùng vỹ và mãnh liệt. Du khách có thể trekking đường rừng để tới thác hoặc đi xe máy để thử thách sự mạo hiểm. Thác Nai trở thành điểm chấm phá trong hành trình thăm quanlàng Nặm Đăm Hà Giang. Nơi này thích hợp để xả nhiệt ngày hè hay đơn giản bạn đang muốn đi trốn khỏi cái nóng của thành thị. Theokinh nghiệm du lịch làng Nặm Đăm Hà Giang, du khách tới đây thường chọn ở homestay để cùng trải nghiệm cuộc sống sinh hoạt với bà con địa phương. Nhà ở Nặm Đăm đều là nhà trình tường với lối kiến trúc truyền thống, thân thiện với thiên nhiên. Nhà dân có gian thờ cúng, gian để tiếp khách và gian để ngủ nghỉ. Mái lợp ngói âm dương, mát về mùa hè, ấm áp vào mùa đông. Đầy là kết quả cho sức sáng tạo của ông cha từ thời xa xưa để chống lại sự khắc nghiệt của thời tiết cao nguyên đá. Qua năm tháng, những ngôi nhà trình tường vẫn còn tồn tại, trở thành điểm đặc biệt thu hút khách du lịch. Theokinh nghiệm du lịch làng Nặm Đăm Hà Giang, tới đây, du khách có thể tham gia vào nấu nướng, sản xuất cùng gia chủ, trải nghiệm tắm lá thuốc và giao lưu văn nghệ cùng bà con vào mỗi tối cuối tuần. Người dân ởlàng Nặm Đăm Hà Giangđa phần là người Dao, họ rất mến khách và thân thiện. Họ vẫn còn giữ được bản sắc văn hoá truyền thống, thể hiện rõ ràng qua lối sống, ẩm thực, kiến trúc, trang phục truyền thống, lời ca tiếng hát…. Có thể nói, mọi thứ ở Nặm Đăm đều thân thiện với môi trường. Quanh năm ở Nặm Đăm đều có lễ hội, điển hình như lễ hội bắt cá vào ngày 3 tháng 3 âm lịch hàng năm. Đây là dịp để con cái bày tỏ lòng biết ơn tới tổ tiên, bắt cá chia cho các hộ dân làm mâm cúng cho gia tiên. Lễ cấp sắc là lễ cho người đàn ông trưởng thành, cũng là một lễ hội lớn quan trọng trong năm của bà con người Dao. Và sau bữa sáng nhẹ nhàng, du khách đã có thể theo chân người dân đi làm đồng để hít hà không khí trong lành và tham quan mô hình sản xuất hoặc tham gia vào các hoạt động làm nông nghiệp cùng đồng bào. Gần thôn Nặm Đăm có một thôn khác của người Mông là thôn Nam Sơn. Nếu có thời gian, bạn đừng bỏ qua việc ghé thăm thôn này, ngồi tâm sự, thưởng thức rượu ngô của người Mông cũng giúp chuyến đilàng Nặm Đăm Hà Giangcủa bạn thêm trọn vẹn đấy. >>Xem thêm:Cẩm nang du lịch Hà Giang từ A-Z Trên hành trình đến với Quản Bạ, chắc chắn du khách không thể bỏ qua Cổng trời Quản Bạ, một điểm ngắm Hà Giang siêu đỉnh. Hành trình để chinh phục cổng trời không dễ dàng, đó là những khúc cua tay áo ngoằn ngoèo và khó nhằn. Ấy vậy mà, trái ngọt chính là cảnh sắc thiên nhiên tuyệt đẹp sẽ đánh bay mọi mệt mỏi trước đó của bạn. Từ Cổng trời Quản Bạ, du khách sẽ thấy thị trấn Tam Sơn với những mái nhà nhỏ nhắn ẩn hiện phía dưới, núi non trùng điệp như không có điểm dừng, ruộng lúa mênh mông trù phú… Tất cả đều thu gọn lại trong tầm mắt một cách trọn vẹn và hoàn hảo. Tới Quản Bạ mà bỏ qua Cổng trời thì quả là thiếu sót. Lùng Tám thuộc huyện Quản Bạ, nằm dưới chân núi, bên con sông Miện thơ mộng. Ở đây, người Mông vẫn còn giữ được nghề dệt vải lanh truyền thống với quy trình thủ công. Đến Lùng Tam, ngoài việc được tìm hiểu quy trình dệt lanh, khách thập phương còn có cơ hội được trực tiếp trải nghiệm dệt vải độc đáo. Không chỉ có áo, váy, ở đây, vải lanh còn làm ra khăn trải bàn, túi xách, ví… với những hoạ tiết mang đặc trưng của người dân vùng cao nguyên đá. Trên đây là thông tin vềLàng Nặm Đăm Hà Giang Tuyên Quangcho bạn và gia đình tham khảo. Theo dõiDu lịch Việt Namđể cập nhật thêm nhiều điểm đến mới cùng kinh nghiệm vi vu hữu ích cho chuyến đi sắp tới của mình nhé. Yến Yến"
